{
  "schema": "assure/scanner-evaluation-request/v1",
  "profile": "enforce",
  "mode": "commit-pair",
  "object_format": "sha1",
  "repository": { "host": "github.com", "owner": "acme", "name": "spec-to-rest" },
  "ref": "refs/heads/main",
  "default_branch_ref": "refs/heads/main",
  "base_commit_oid": "8d7f2c31a09b64e5dd10fcab7e93245160c8ba72",
  "candidate_commit_oid": "3e19afc65b2704d8ce8b1f09a4de6273550d914b"
}
